2,Social and Emotional,Begins to smile at people,http://phil.cdc.gov/PHIL_Images/20651/20651_lores.jpg
2,Social and Emotional,Can briefly calm herself (may bring hands to mouth and suck on hand),http://phil.cdc.gov/PHIL_Images/20653/20653_lores.jpg
2,Social and Emotional,Tries to look at parent,http://phil.cdc.gov/PHIL_Images/20654/20654_lores.jpg
2,Language and Communication,"Coos, makes gurgling sounds",http://phil.cdc.gov/PHIL_Images/20655/20655_lores.jpg
2,Language and Communication,Turns head toward sounds,http://phil.cdc.gov/PHIL_Images/20656/20656_lores.jpg
2,Cognitive,Pays attention to faces,http://phil.cdc.gov/PHIL_Images/20657/20657_lores.jpg
2,Cognitive,Begins to follow things with eyes and recognize people at a distance,http://phil.cdc.gov/PHIL_Images/20658/20658_lores.jpg
2,Cognitive,"Begins to act bored (cries, fussy) if activity doesn’t change",http://phil.cdc.gov/PHIL_Images/20659/20659_lores.jpg
2,Movement/Physical Development,Can hold head up and begins to push up when lying on tummy,http://phil.cdc.gov/PHIL_Images/20660/20660_lores.jpg
2,Movement/Physical Development,Makes smoother movements with arms and legs,http://phil.cdc.gov/PHIL_Images/20661/20661_lores.jpg
4,Social and Emotional,"Smiles spontaneously, especially at people",http://phil.cdc.gov/PHIL_Images/20662/20662_lores.jpg
4,Social and Emotional,Likes to play with people and might cry when playing stops,http://phil.cdc.gov/PHIL_Images/20663/20663_lores.jpg
4,Social and Emotional,"Copies some movements and facial expressions, like smiling or frowning",http://phil.cdc.gov/PHIL_Images/20664/20664_lores.jpg
4,Language and Communication,Begins to babble,http://phil.cdc.gov/PHIL_Images/20665/20665_lores.jpg
4,Language and Communication,Babbles with expression and copies sounds he hears,http://phil.cdc.gov/PHIL_Images/20666/20666_lores.jpg
4,Language and Communication,"Cries in different ways to show hunger, pain, or being tired",http://phil.cdc.gov/PHIL_Images/20667/20667_lores.jpg
4,Cognitive,Lets you know if he is happy or sad,http://phil.cdc.gov/PHIL_Images/20668/20668_lores.jpg
4,Cognitive,Responds to affection,http://phil.cdc.gov/PHIL_Images/20669/20669_lores.jpg
4,Cognitive,Reaches for toy with one hand,http://phil.cdc.gov/PHIL_Images/20670/20670_lores.jpg
4,Cognitive,"Uses hands and eyes together, such as seeing a toy and reaching for it",http://phil.cdc.gov/PHIL_Images/20671/20671_lores.jpg
4,Cognitive,Follows moving things with eyes from side to side,http://phil.cdc.gov/PHIL_Images/20672/20672_lores.jpg
4,Cognitive,Watches faces closely,http://phil.cdc.gov/PHIL_Images/20673/20673_lores.jpg
4,Cognitive,Recognizes familiar people and things at a distance,http://phil.cdc.gov/PHIL_Images/20674/20674_lores.jpg
4,Movement/Physical Development,"Holds head steady, unsupported",http://phil.cdc.gov/PHIL_Images/20675/20675_lores.jpg
4,Movement/Physical Development,Pushes down on legs when feet are on a hard surface,http://phil.cdc.gov/PHIL_Images/20676/20676_lores.jpg
4,Movement/Physical Development,May be able to roll over from tummy to back,http://phil.cdc.gov/PHIL_Images/20677/20677_lores.jpg
4,Movement/Physical Development,Can hold a toy and shake it and swing at dangling toys,http://phil.cdc.gov/PHIL_Images/20678/20678_lores.jpg
4,Movement/Physical Development,Brings hands to mouth,http://phil.cdc.gov/PHIL_Images/20679/20679_lores.jpg
4,Movement/Physical Development,"When lying on stomach, pushes up to elbows",http://phil.cdc.gov/PHIL_Images/20680/20680_lores.jpg
6,Social and Emotional,Knows familiar faces and begins to know if someone is a stranger,http://phil.cdc.gov/PHIL_Images/20681/20681_lores.jpg
6,Social and Emotional,"Likes to play with others, especially parents",http://phil.cdc.gov/PHIL_Images/20682/20682_lores.jpg
6,Social and Emotional,Responds to other people’s emotions and often seems happy,http://phil.cdc.gov/PHIL_Images/20683/20683_lores.jpg
6,Social and Emotional,Likes to look at self in a mirror,http://phil.cdc.gov/PHIL_Images/20684/20684_lores.jpg
6,Language and Communication,Responds to sounds by making sounds,http://phil.cdc.gov/PHIL_Images/20685/20685_lores.jpg
6,Language and Communication,"Strings vowels together when babbling (“ah,” “eh,” “oh”) and likes taking turns with parent while making sounds",http://phil.cdc.gov/PHIL_Images/20686/20686_lores.jpg
6,Language and Communication,Responds to own name,http://phil.cdc.gov/PHIL_Images/20687/20687_lores.jpg
6,Language and Communication,Makes sounds to show joy and displeasure,http://phil.cdc.gov/PHIL_Images/20688/20688_lores.jpg
6,Language and Communication,"Begins to say consonant sounds (jabbering with “m,” “b”)",http://phil.cdc.gov/PHIL_Images/20689/20689_lores.jpg
6,Cognitive,Looks around at things nearby,http://phil.cdc.gov/PHIL_Images/20690/20690_lores.jpg
6,Cognitive,Brings things to mouth,http://phil.cdc.gov/PHIL_Images/20691/20691_lores.jpg
6,Cognitive,Shows curiosity about things and tries to get things that are out of reach,http://phil.cdc.gov/PHIL_Images/20692/20692_lores.jpg
6,Cognitive,Begins to pass things from one hand to the other,http://phil.cdc.gov/PHIL_Images/20693/20693_lores.jpg
6,Movement/Physical Development,"Rolls over in both directions (front to back, back to front)",http://phil.cdc.gov/PHIL_Images/20694/20694_lores.jpg
6,Movement/Physical Development,Begins to sit without support,http://phil.cdc.gov/PHIL_Images/20695/20695_lores.jpg
6,Movement/Physical Development,"When standing, supports weight on legs and might bounce",http://phil.cdc.gov/PHIL_Images/20696/20696_lores.jpg
6,Movement/Physical Development,"Rocks back and forth, sometimes crawling backward before moving forward",http://phil.cdc.gov/PHIL_Images/20697/20697_lores.jpg
9,Social and Emotional,May be afraid of strangers,http://phil.cdc.gov/PHIL_Images/20698/20698_lores.jpg
9,Social and Emotional,May be clingy with familiar adults,http://phil.cdc.gov/PHIL_Images/20699/20699_lores.jpg
9,Social and Emotional,Has favorite toys,http://phil.cdc.gov/PHIL_Images/20700/20700_lores.jpg
9,Language and Communication,Understands “no”,http://phil.cdc.gov/PHIL_Images/20701/20701_lores.jpg
9,Language and Communication,Makes a lot of different sounds like “mamamama” and “bababababa”,http://phil.cdc.gov/PHIL_Images/20702/20702_lores.jpg
9,Language and Communication,Copies sounds and gestures of others,http://phil.cdc.gov/PHIL_Images/20703/20703_lores.jpg
9,Language and Communication,Uses fingers to point at things,http://phil.cdc.gov/PHIL_Images/20704/20704_lores.jpg
9,Cognitive,Watches the path of something as it falls,http://phil.cdc.gov/PHIL_Images/20705/20705_lores.jpg
9,Cognitive,Looks for things she sees you hide,http://phil.cdc.gov/PHIL_Images/20706/20706_lores.jpg
9,Cognitive,Plays peek-a-boo,http://phil.cdc.gov/PHIL_Images/20707/20707_lores.jpg
9,Cognitive,Puts things in his mouth,http://phil.cdc.gov/PHIL_Images/20708/20708_lores.jpg
9,Cognitive,Moves things smoothly from one hand to the other,http://phil.cdc.gov/PHIL_Images/20709/20709_lores.jpg
9,Cognitive,Picks up things like cereal o’s between thumb and index finger,http://phil.cdc.gov/PHIL_Images/20710/20710_lores.jpg
9,Movement/Physical Development,"Stands, holding on",http://phil.cdc.gov/PHIL_Images/20711/20711_lores.jpg
9,Movement/Physical Development,Can get into sitting position,http://phil.cdc.gov/PHIL_Images/20712/20712_lores.jpg
9,Movement/Physical Development,Sits without support,http://phil.cdc.gov/PHIL_Images/20713/20713_lores.jpg
9,Movement/Physical Development,Pulls to stand,http://phil.cdc.gov/PHIL_Images/20714/20714_lores.jpg
9,Movement/Physical Development,Crawls,http://phil.cdc.gov/PHIL_Images/20715/20715_lores.jpg
12,Social and Emotional,Is shy or nervous with strangers,http://phil.cdc.gov/PHIL_Images/20716/20716_lores.jpg
12,Social and Emotional,Cries when mom or dad leaves,http://phil.cdc.gov/PHIL_Images/20717/20717_lores.jpg
12,Social and Emotional,Has favorite things and people,http://phil.cdc.gov/PHIL_Images/20718/20718_lores.jpg
12,Social and Emotional,Shows fear in some situations,http://phil.cdc.gov/PHIL_Images/20719/20719_lores.jpg
12,Social and Emotional,Hands you a book when he wants to hear a story,http://phil.cdc.gov/PHIL_Images/20720/20720_lores.jpg
12,Social and Emotional,Repeats sounds or actions to get attention,http://phil.cdc.gov/PHIL_Images/20721/20721_lores.jpg
12,Social and Emotional,Puts out arm or leg to help with dressing,http://phil.cdc.gov/PHIL_Images/20722/20722_lores.jpg
12,Social and Emotional,Plays games such as “peek-a-boo” and “pat-a-cake”,http://phil.cdc.gov/PHIL_Images/20723/20723_lores.jpg
12,Language and Communication,Responds to simple spoken requests,http://phil.cdc.gov/PHIL_Images/20724/20724_lores.jpg
12,Language and Communication,"Uses simple gestures, like shaking head “no” or waving “bye-bye”",http://phil.cdc.gov/PHIL_Images/20725/20725_lores.jpg
12,Language and Communication,Makes sounds with changes in tone (sounds more like speech),http://phil.cdc.gov/PHIL_Images/20726/20726_lores.jpg
12,Language and Communication,Says “mama” and “dada” and exclamations like “uh-oh!”,http://phil.cdc.gov/PHIL_Images/20727/20727_lores.jpg
12,Language and Communication,Tries to say words you say,http://phil.cdc.gov/PHIL_Images/20728/20728_lores.jpg
12,Cognitive,"Explores things in different ways, like shaking, banging, throwing",http://phil.cdc.gov/PHIL_Images/20729/20729_lores.jpg
12,Cognitive,Finds hidden things easily,http://phil.cdc.gov/PHIL_Images/20730/20730_lores.jpg
12,Cognitive,Looks at the right picture or thing when it’s named,http://phil.cdc.gov/PHIL_Images/20731/20731_lores.jpg
12,Cognitive,Copies gestures,http://phil.cdc.gov/PHIL_Images/20732/20732_lores.jpg
12,Cognitive,"Starts to use things correctly; for example, drinks from a cup, brushes hair",http://phil.cdc.gov/PHIL_Images/20733/20733_lores.jpg
12,Cognitive,Bangs two things together,http://phil.cdc.gov/PHIL_Images/20734/20734_lores.jpg
12,Cognitive,"Puts things in a container, takes things out of a container",http://phil.cdc.gov/PHIL_Images/20735/20735_lores.jpg
12,Cognitive,Lets things go without help,http://phil.cdc.gov/PHIL_Images/20736/20736_lores.jpg
12,Cognitive,Pokes with index (pointer) finger,http://phil.cdc.gov/PHIL_Images/20737/20737_lores.jpg
12,Cognitive,Follows simple directions like “pick up the toy”,http://phil.cdc.gov/PHIL_Images/20738/20738_lores.jpg
12,Movement/Physical Development,Gets to a sitting position without help,http://phil.cdc.gov/PHIL_Images/20739/20739_lores.jpg
12,Movement/Physical Development,"Pulls up to stand, walks holding on to furniture (“cruising”)",http://phil.cdc.gov/PHIL_Images/20740/20740_lores.jpg
12,Movement/Physical Development,May take a few steps without holding on,http://phil.cdc.gov/PHIL_Images/20741/20741_lores.jpg
12,Movement/Physical Development,May stand alone,http://phil.cdc.gov/PHIL_Images/20742/20742_lores.jpg
18,Social and Emotional,Likes to hand things to others as play,http://phil.cdc.gov/PHIL_Images/20743/20743_lores.jpg
18,Social and Emotional,May have temper tantrums,http://phil.cdc.gov/PHIL_Images/20744/20744_lores.jpg
18,Social and Emotional,May be afraid of strangers,http://phil.cdc.gov/PHIL_Images/20745/20745_lores.jpg
18,Social and Emotional,Shows affection to familiar people,http://phil.cdc.gov/PHIL_Images/20746/20746_lores.jpg
18,Social and Emotional,"Plays simple pretend, such as feeding a doll",http://phil.cdc.gov/PHIL_Images/20747/20747_lores.jpg
18,Social and Emotional,May cling to caregivers in new situations,http://phil.cdc.gov/PHIL_Images/20748/20748_lores.jpg
18,Social and Emotional,Points to show others something interesting,http://phil.cdc.gov/PHIL_Images/20749/20749_lores.jpg
18,Social and Emotional,Explores alone but with parent close by,http://phil.cdc.gov/PHIL_Images/20750/20750_lores.jpg
18,Language and Communication,Says several single words,http://phil.cdc.gov/PHIL_Images/20751/20751_lores.jpg
18,Language and Communication,Says and shakes head “no”,http://phil.cdc.gov/PHIL_Images/20752/20752_lores.jpg
18,Language and Communication,Points to show someone what he wants,http://phil.cdc.gov/PHIL_Images/20753/20753_lores.jpg
18,Cognitive,"Knows what ordinary things are for; for example, telephone, brush, spoon",http://phil.cdc.gov/PHIL_Images/20754/20754_lores.jpg
18,Cognitive,Points to get the attention of others,http://phil.cdc.gov/PHIL_Images/20755/20755_lores.jpg
18,Cognitive,Shows interest in a doll or stuffed animal by pretending to feed,http://phil.cdc.gov/PHIL_Images/20756/20756_lores.jpg
18,Cognitive,Points to one body part,http://phil.cdc.gov/PHIL_Images/20757/20757_lores.jpg
18,Cognitive,Scribbles on his own,http://phil.cdc.gov/PHIL_Images/20758/20758_lores.jpg
18,Cognitive,"Can follow 1-step verbal commands without any gestures; for example, sits when you say “sit down”",http://phil.cdc.gov/PHIL_Images/20759/20759_lores.jpg
18,Movement/Physical Development,Walks alone,http://phil.cdc.gov/PHIL_Images/20760/20760_lores.jpg
18,Movement/Physical Development,May walk up steps and run,http://phil.cdc.gov/PHIL_Images/20761/20761_lores.jpg
18,Movement/Physical Development,Pulls toys while walking,http://phil.cdc.gov/PHIL_Images/20762/20762_lores.jpg
18,Movement/Physical Development,Can help undress herself,http://phil.cdc.gov/PHIL_Images/20763/20763_lores.jpg
18,Movement/Physical Development,Drinks from a cup,http://phil.cdc.gov/PHIL_Images/20764/20764_lores.jpg
18,Movement/Physical Development,Eats with a spoon,http://phil.cdc.gov/PHIL_Images/20765/20765_lores.jpg
24,Social and Emotional,"Copies others, especially adults and older children",http://phil.cdc.gov/PHIL_Images/20766/20766_lores.jpg
24,Social and Emotional,Gets excited when with other children,http://phil.cdc.gov/PHIL_Images/20767/20767_lores.jpg
24,Social and Emotional,Shows more and more independence,http://phil.cdc.gov/PHIL_Images/20768/20768_lores.jpg
24,Social and Emotional,Shows defiant behavior (doing what he has been told not to),http://phil.cdc.gov/PHIL_Images/20769/20769_lores.jpg
24,Social and Emotional,"Plays mainly beside other children, but is beginning to include other children, such as in chase games",http://phil.cdc.gov/PHIL_Images/20770/20770_lores.jpg
24,Language and Communication,Points to things or pictures when they are named,http://phil.cdc.gov/PHIL_Images/20771/20771_lores.jpg
24,Language and Communication,Knows names of familiar people and body parts,http://phil.cdc.gov/PHIL_Images/20772/20772_lores.jpg
24,Language and Communication,Says sentences with 2 to 4 words,http://phil.cdc.gov/PHIL_Images/20773/20773_lores.jpg
24,Language and Communication,Follows simple instructions,http://phil.cdc.gov/PHIL_Images/20774/20774_lores.jpg
24,Language and Communication,Repeats words overheard in conversation,http://phil.cdc.gov/PHIL_Images/20775/20775_lores.jpg
24,Language and Communication,Points to things in a book,http://phil.cdc.gov/PHIL_Images/20776/20776_lores.jpg
24,Cognitive,Finds things even when hidden under two or three covers,http://phil.cdc.gov/PHIL_Images/20777/20777_lores.jpg
24,Cognitive,Begins to sort shapes and colors,http://phil.cdc.gov/PHIL_Images/20778/20778_lores.jpg
24,Cognitive,Completes sentences and rhymes in familiar books,http://phil.cdc.gov/PHIL_Images/20779/20779_lores.jpg
24,Cognitive,Plays simple make-believe games,http://phil.cdc.gov/PHIL_Images/20780/20780_lores.jpg
24,Cognitive,Builds towers of 4 or more blocks,http://phil.cdc.gov/PHIL_Images/20781/20781_lores.jpg
24,Cognitive,Might use one hand more than the other,http://phil.cdc.gov/PHIL_Images/20782/20782_lores.jpg
24,Cognitive,Follows two-step instructions such as “Pick up your shoes and put them in the closet.”,http://phil.cdc.gov/PHIL_Images/20783/20783_lores.jpg
24,Cognitive,"Names items in a picture book such as a cat, bird, or dog",http://phil.cdc.gov/PHIL_Images/20784/20784_lores.jpg
24,Movement/Physical Development,Stands on tiptoe,http://phil.cdc.gov/PHIL_Images/20785/20785_lores.jpg
24,Movement/Physical Development,Kicks a ball,http://phil.cdc.gov/PHIL_Images/20786/20786_lores.jpg
24,Movement/Physical Development,Begins to run,http://phil.cdc.gov/PHIL_Images/20787/20787_lores.jpg
24,Movement/Physical Development,Climbs onto and down from furniture without help,http://phil.cdc.gov/PHIL_Images/20788/20788_lores.jpg
24,Movement/Physical Development,Walks up and down stairs holding on,http://phil.cdc.gov/PHIL_Images/20789/20789_lores.jpg
24,Movement/Physical Development,Throws ball overhand,http://phil.cdc.gov/PHIL_Images/20790/20790_lores.jpg
24,Movement/Physical Development,Makes or copies straight lines and circles,http://phil.cdc.gov/PHIL_Images/20791/20791_lores.jpg
36,Social and Emotional,Copies adults and friends,http://phil.cdc.gov/PHIL_Images/20792/20792_lores.jpg
36,Social and Emotional,Shows affection for friends without prompting,http://phil.cdc.gov/PHIL_Images/20793/20793_lores.jpg
36,Social and Emotional,Takes turns in games,http://phil.cdc.gov/PHIL_Images/20794/20794_lores.jpg
36,Social and Emotional,Shows concern for crying friend,http://phil.cdc.gov/PHIL_Images/20795/20795_lores.jpg
36,Social and Emotional,Understands the idea of “mine” and “his” or “hers”,http://phil.cdc.gov/PHIL_Images/20796/20796_lores.jpg
36,Social and Emotional,Shows a wide range of emotions,http://phil.cdc.gov/PHIL_Images/20797/20797_lores.jpg
36,Social and Emotional,Separates easily from mom and dad,http://phil.cdc.gov/PHIL_Images/20798/20798_lores.jpg
36,Social and Emotional,May get upset with major changes in routine,http://phil.cdc.gov/PHIL_Images/20799/20799_lores.jpg
36,Social and Emotional,Dresses and undresses self,http://phil.cdc.gov/PHIL_Images/20800/20800_lores.jpg
36,Language and Communication,Follows instructions with 2 or 3 steps,http://phil.cdc.gov/PHIL_Images/20801/20801_lores.jpg
36,Language and Communication,Can name most familiar things,http://phil.cdc.gov/PHIL_Images/20802/20802_lores.jpg
36,Language and Communication,"Understands words like “in,” “on,” and “under”",http://phil.cdc.gov/PHIL_Images/20803/20803_lores.jpg
36,Language and Communication,"Says first name, age, and sex",http://phil.cdc.gov/PHIL_Images/20804/20804_lores.jpg
36,Language and Communication,Names a friend,http://phil.cdc.gov/PHIL_Images/20805/20805_lores.jpg
36,Language and Communication,"Says words like “I,” “me,” “we,” and “you” and some plurals (cars, dogs, cats)",http://phil.cdc.gov/PHIL_Images/20806/20806_lores.jpg
36,Language and Communication,Talks well enough for strangers to understand most of the time,http://phil.cdc.gov/PHIL_Images/20807/20807_lores.jpg
36,Language and Communication,Carries on a conversation using 2 to 3 sentences,http://phil.cdc.gov/PHIL_Images/20808/20808_lores.jpg
36,Cognitive,"Can work toys with buttons, levers, and moving parts",http://phil.cdc.gov/PHIL_Images/20809/20809_lores.jpg
36,Cognitive,"Plays make-believe with dolls, animals, and people",http://phil.cdc.gov/PHIL_Images/20810/20810_lores.jpg
36,Cognitive,Does puzzles with 3 or 4 pieces,http://phil.cdc.gov/PHIL_Images/20811/20811_lores.jpg
36,Cognitive,Understands what “two” means,http://phil.cdc.gov/PHIL_Images/20812/20812_lores.jpg
36,Cognitive,Copies a circle with pencil or crayon,http://phil.cdc.gov/PHIL_Images/20813/20813_lores.jpg
36,Cognitive,Turns book pages one at a time,http://phil.cdc.gov/PHIL_Images/20814/20814_lores.jpg
36,Cognitive,Builds towers of more than 6 blocks,http://phil.cdc.gov/PHIL_Images/20815/20815_lores.jpg
36,Cognitive,Screws and unscrews jar lids or turns door handle,http://phil.cdc.gov/PHIL_Images/20816/20816_lores.jpg
36,Movement/Physical Development,Climbs well,http://phil.cdc.gov/PHIL_Images/20817/20817_lores.jpg
36,Movement/Physical Development,Runs easily,http://phil.cdc.gov/PHIL_Images/20818/20818_lores.jpg
36,Movement/Physical Development,Pedals a tricycle (3-wheel bike),http://phil.cdc.gov/PHIL_Images/20819/20819_lores.jpg
36,Movement/Physical Development,"Walks up and down stairs, one foot on each step",http://phil.cdc.gov/PHIL_Images/20820/20820_lores.jpg
